{"$schema":"https://json-schema.org/draft/2020-12/schema","$id":"https://agile-v.org/schemas/APPROVAL.v2.schema.json","title":"Approval v2 (scoped, bound, single-use aware)","type":"object","required":["schema_version","compatibility","migration","fixture_owner","approval"],"properties":{"schema_version":{"const":"2.0"},"compatibility":{"type":"string","minLength":1},"migration":{"type":"string","minLength":1},"fixture_owner":{"type":"string","minLength":1},"approval":{"type":"object","required":["id","task_id","gate_id","issued_at","expires_at","decision","approver","scope","binding","usage"],"properties":{"id":{"pattern":"^APR-[A-Z0-9-]+$"},"task_id":{"type":"string","minLength":1},"correlation_id":{"type":"string"},"gate_id":{"type":"string","minLength":1},"control_refs":{"type":"array","items":{"type":"string"}},"issued_at":{"format":"date-time"},"decided_at":{"format":"date-time"},"expires_at":{"format":"date-time"},"decision":{"enum":["approved","rejected","expired","revoked","dismissed","pending"]},"approver":{"type":"object","required":["identity","role","authority_source"],"properties":{"identity":{"type":"string","minLength":1},"role":{"type":"string","minLength":1},"authority_source":{"type":"string","minLength":1}},"additionalProperties":true},"scope":{"type":"object","required":["action","resources"],"properties":{"action":{"type":"string","minLength":1},"resources":{"type":"array","minItems":1,"items":{"type":"string"}},"data_classes":{"type":"array","items":{"type":"string"}}},"additionalProperties":true},"binding":{"type":"object","required":["artifact_digest"],"properties":{"artifact_digest":{"pattern":"^sha256:[a-f0-9]{64}$"},"requirement_baseline_id":{"type":"string"},"policy_digest":{"pattern":"^sha256:[a-f0-9]{64}$"},"resume_token_digest":{"pattern":"^sha256:[a-f0-9]{64}$"}},"additionalProperties":true},"usage":{"type":"object","required":["reusable"],"properties":{"reusable":{"type":"boolean"},"consumed_at":{"type":["string","null"],"format":"date-time"}},"additionalProperties":true}},"additionalProperties":true}},"additionalProperties":false}
